commentId,brewerId,brewerName,date,comment,replyIds
22673,35672,jclark1031,"September 04, 2015  1:24pm","451 billion cells: 5 smack pack(s) or vial(s) of liquid yeast, or 23 gram(s) of dry yeast.",[]
22678,35672,jclark1031,"September 05, 2015 12:36pm","split between so5 and northwest, will probably dry hop one with with something other than citra",['22679']
22679,35672,jclark1031,"September 05, 2015 12:36pm",maybe 2 galaxy 2 simcoe?,[]
22680,35672,jclark1031,"September 05, 2015  1:48pm","IBUs are calculated low, but 8 oz of hops will be sitting in the wort while I slowly run through my chiller, will note bitterness when I taste in 4 weeks or so.",[]
22693,35672,jclark1031,"September 08, 2015  9:01pm","used was too small amount of strike watrer, should have been 9, used 7. also, got stuck twice, so i had to blow, maybe that cause a channel?  maybe my pH was off? any how, 7 gallons strike, 164 strike, added it qt cool to get to 162, 148 mash, 146 at the end, 90 minute mash, mashed out to 175, sparged with 178 water, pulled 12.25 gallons, added 1 distilled, 1052 OG at 66, hop stand while running through chiller, filled each a bit over 5, the short one went first so didnt get as long a hop stand.",[]
22713,35672,jclark1031,"September 15, 2015 10:51pm","9/15 s05 was finished so dry hopped with 4 oz citra, wyeast northwest ale was still chugging along, left it be.",[]
22744,35672,jclark1031,"September 22, 2015  1:48am","kegged s05, FG was 1.004, smelled nice",['22750']
22750,35672,jclark1031,"September 23, 2015  6:25pm",6.3%,[]
