commentId,brewerId,brewerName,date,comment,replyIds
24528,97587,Mimi Dabul,"January 05, 2017  3:01pm","We offer original high quality passports,drivers licence,id cards and other registered documents at affordable prices.Our documents are genuine and registered.You are free to contact us for any inquiry and questions.
Registered real (genuine) passport, identity card or driving license or any other document is simple. we can in real documents.it takes time, skill and socialize, to get it done. Note that the actual document will be registered with the country's database, so you can travel in a country of your choice or in the country,
To order, please send your questions to our e-mail
-----------------------------------------------------------------------------
Contact emails ......... berningconstain@gmail.com
General support .......berningconstain@gmail.com
Skype ........ berning121
------------------------------------------------------------------------------
Real USA (United States) passports,
Real Australian passports,
Real Belgium passports,
Real Brazilian (Brazil) passports,
Real Canadian (Canada) passports,
Real Finnish (Finland) passports,
Real French (France) passports,
Real German (Germany) passports,
Real Dutch (Netherlands / Holland) passports,
Real Israel passports,
Real UK (United Kingdom) passports,
Real Spanish (Spain) passports,
Real Mexican (Mexico) passports,
Buy genuine South African passport.
Buy genuine Australian driver licenses,
Buy Real Canadian driver licenses,
buy real French (France) driver licenses,
Sale Real Dutch (Netherlands / Holland) driving licenses,
Real estate German (Germany) driving licenses,
Sale Real UK (United Kingdom) driving licenses,
Buying real diplomatic passports,
Sale Real USA (United States) passports,
Buy genuine Australian passports,
Buy Properties Belgium passports,
Buy Real Brazilian (Brazil) passports,
Sale Real Canadian (Canada) passports,
buy real Finnish (Finland) passports,
buy real French (France) passports,
Buying real German (Germany) passports,
Sale Real Dutch (Netherlands / Holland) passports,
Sale Real Israel passports,
Sale Real UK (United Kingdom) passports,
Sale Real UK (United Kingdom) driving licenses,
Buying real diplomatic passports,
Real Australian passports for sale,
Real Belgium passports for sale,
Real Brazilian (Brazil) passports for sale,
Real Canadian (Canada) passports for sale,
Real Finnish (Finland) passports for sale,
Real French (France) passports for sale,
Real German (Germany) passports for sale,
Real Dutch (Netherlands / Holland) passports for sale,
Real Israeli passports
buy, receive, Real, passports, ID cards, uk, sale, online, Canadian, UK, selling, novelty, counterfeit, sheen, american, united, states, usa, Italian, Malaysian, Australian, documents identiteitsontwikkeling, idetification , driver, license, driving, residence, license, SSN false passport ID, free fake passport, identity theft, forgery, novelty, camoflauge, passing, anonymous, private, safe, traveling, anti-terrorism, international, offshore, banks, identity card, driver license, online, buy, cheap, wholesale, new identity, secondly, nationality, identity, identification, documents, diplomatic, nationality, how, where to get to get, buy, buy, make, build, one, passport, ID, british, Honduras, Britain USA, Canada, Canadian, foreign, visa, Swiss, map, ids, document, receive, visa, tickets, foriegn
Contact emails ......... berningconstain@gmail.com
General support ......... berningconstain@gmail.com
Skype ........ berning121",[]
