commentId,brewerId,brewerName,date,comment,replyIds
16273,32661,asteveoconnor,"November 22, 2013  5:56pm","Low extraction?
I intended to do a three-step mash: 140, 156, 168; however, I doughed in too hot; I fumbled with the water to get the mash settled at 153; this dropped to 148 in the 60 minute mash time; oh well, each batch I learn/remember more.",[]
17241,32661,asteveoconnor,"February 08, 2014  1:58am",Made a starter at 5 p.m. today using Wyeast Thames Valley Ale.,[]
17203,32661,asteveoconnor,"February 05, 2014  3:41am",Is anyone reading this yet?,[]
17255,32661,asteveoconnor,"February 08, 2014 11:52pm","...avoid the temptation of using a higher extracting malt, such as a German Pils, or a Marris Otter; the dryish character that the Canadian grains contribute to N. American profile is what makes this beer!",[]
18546,32661,asteveoconnor,"June 20, 2014  2:49am","...i hate predictive text! The ""it's"" in the previous post was supposed to be ""its.""",[]
18544,32661,asteveoconnor,"June 20, 2014  1:31am","June 2014
2-row malt will be used for it's diastatic power; this should provide a highly attenative wort; perhaps it will increase the extraction too.",[]
18579,32661,asteveoconnor,"June 22, 2014  2:39pm","...too much water, and no OG reading!",[]
