commentId,brewerId,brewerName,date,comment,replyIds
19774,37888,duncan,"October 25, 2014  4:53pm","just for the hell of it, added a bit of the dregs of a chimay bottle to the starter with the WLP550.",[]
19783,37888,duncan,"October 26, 2014 12:39pm","pitched at ~67F, let temp rise freely with fermenter sitting in shallow water bath to provide a slight cooling effect as it warms.",[]
19787,37888,duncan,"October 26, 2014  3:46pm","all sugar dissolved in water and added after initial fermentation, at which time the temperature is brought back below 70F before being allowed to rise again.",[]
21622,37888,duncan,"April 11, 2015 11:32pm","~25g dried rose buds added, with juice and zest of 2 lemons, following subsequent fermentation.
10g dried rose buds added to keg (after ~6 month aging).",[]
