commentId,brewerId,brewerName,date,comment,replyIds
19893,49508,raiderrob67,"November 05, 2014  4:41pm","Sound's great. my sister in-law bought a bunch of that PB2 powder that she use's to make shake's and stuff, I looked at that and thought ""hey! I could add this to beer!"" will be looking forward to hear how this comes out.",['19894']
19894,22525,Derek Gillespie,"November 05, 2014  5:27pm",I've used PB2 before in a stout but the malt bill was too roasty and dark to do the peanut butter justice.  There is also a PB2 with chocolate and a friend has used that to make a PB Porter too.  My concern is the PB2 in secondary (which I haven't done yet) - will the yeast eat it?  Should I cold crash?,[]
19896,49508,raiderrob67,"November 06, 2014  1:53am","Yea, the yeast will eat some of it. my concern with adding that in secondary is there is no way to sanitize it. if you had an unopened package I would not worry, but if you are taking it out of a jar that has been opened there is a chance there will be unwanted little beast living in it.",[]
20729,57330,Alejandro González,"January 28, 2015  2:21pm","Hi, Im attempting to make this recipe. I just mixed the peanut butter powder with vodka for my secondary and find that the powder to liquid ratio makes for a very powdery mix. Did you have this problem? What did you do? Or how did you add the peanut powder to your recipe?",['20777']
20777,22525,Derek Gillespie,"February 02, 2015  4:05pm","I added the PB2 to the boil only the first couple times I made it.  A friend who made the recipe said he used PB2 in the boil and in the secondary (mix it with hot, sterile water).",[]
